conditionCode,conditionName,applicable_gender,pediatric_assessment,presentingComplaint1,presentingComplaint2,presentingComplaint3,presentingComplaint4,presentingComplaint5,presentingComplaint6,presentingPart1,presentingPart2,presentingPart3,presentingPart4,presentingPart5,presentingPart6,assessmentQuery1,assessmentQuery2,assessmentQuery3,assessmentQuery4,assessmentQuery5,assessmentQuery6,assessmentQuery7,assessmentQuery8,source,auxilliaryQuery1,auxilliaryQuery2,auxilliaryQuery3,prevalence_DecisionWeight
C289,Otitis Media in Adults,All,FALSE,Ear Pain,Hearing Difficulty,Fluid Drainage from ear,Headache,Fever,,Middle Ear,Tympanic Membrane ,Head,NIL,NIL,,When did your symptoms start?,Have you experienced any ear pain or discomfort?,Have you had any fluid coming out from the ear?,Have you had any recent runny nose or cold?,Have you experienced any sensation of spinning in the head ?,Do you have any ear problems in the past.,"Are you able to maintain balance while walking, standing , etc?",NIL,,,,,
C290,Trigeminal Neuralgia,All,FALSE,Severe pain in the face,Pain on slight touch or movement,Sudden Pain in the face,NIL,NIL,,Face,Trigeminal Nerve,NIL,NIL,NIL,,How long have you been experiencing these episodes of pain?,"Can you describe the type of pain you are experiencing? (e.g., stabbing, electric shock-like)","Do you have any other symptoms accompanying the pain, such as numbness or tingling?+","Does anything provide relief from the pain, even temporarily?",Are you afraid of performing daily activities due to fear that it may cause pain.,Do you have  history of an recent injury that may be contributing to the pain?,Do you have any underlying medical conditions or history of facial trauma that may be contributing to the pain?,Is the pain localized to specific areas of the face?,,,,,
C291,Cholesteatoma,All,FALSE,Changes in hearing,Fluid Drainage from ear,Ear Pain,Fullness or pressure in ear,NIL,,Middle Ear,Mastoid Bone,Head,NIL,NIL,,When did your symptoms start?,"Have you experienced any changes in hearing, such as hearing loss or ringing in the ears?",Have you ever felt dizzy or like the room is spinning,Does your ear feel full or under pressure?,Have you ever had surgery or any injuries to your ear?,Do you notice any weakness or numbness in your face?,"Does anything make your symptoms better or worse, like certain positions or pressure?",NIL,,,,,
C292,Meniere's Disease,All,FALSE,Spinning sensation,Hearing Difficulty,Fullness or pressure in ear,Sweating,NIL,,Inner Ear,Cochlea,Head,NIL,NIL,,When did your symptoms start?,"Have you noticed any changes in your hearing, like ringing sounds or hearing loss",Do you ever feel like Vomiting or actually  vomit during these episodes?,How often do these episodes occur?,Have you had any recent head injuries?,How often do these episodes occur?,Have you noticed any actions that lead to these symptoms?,NIL,,,,,
C293,Parotitis,All,FALSE,Swelling  in front of ear,Pain in the cheek,Difficulty Chewing or Swallowing,Fever/Chills,Redness/warmth around cheek.,,Parotid Gland,Cheek,Face,NIL,NIL,,When did your symptoms start?,Do you feel pain or tenderness in the swollen area?,"Is the swollen area red, warm, or draining pus?",Have you had any recent dental work or surgery near your mouth?,Have you been in close contact with anyone who has had similar symptoms?,Have you experienced fever or chills?,Have you travelled recently or been in contact with someone sick?,Have you had any previous episodes of pain in the area?,,,,,
C294,Varicella Zoster(chickenpox),All,FALSE,"Rash: Small, Itchy red spots",Fever,Weakness,Itching,Headache,,Skin,Arms,Legs,NIL,NIL,,When did your symptoms start?,Do the spots on skin have itching?,Do you feel tired or fatigued?,Have you had any headaches?,Have you been in contact with anyone who has chickenpox ?,Have you received the chickenpox vaccine in the past?,Have you traveled recently to areas where chickenpox is common?,NIL,,,,,
C295,Herpes Zoster (shingles),All,FALSE,Burning Pain,Rash:one side of body,Itching,Fever,Numbness in the affected area,,Skin,Chest,Abdomen,Face,NIL,,Have you noticed any red spots or blisters on one side of your body?,Do you feel a burning or shooting pain in the same area as the rash?,Have you had a fever recently?,Do you feel tired or fatigued?,Have you been in contact with anyone who had similar symptoms?,Have you had chickenpox in the past?,NIL,NIL,,,,,
C296,Dehydration in children,All,FALSE,Excessive Thirst ,Dry mouth and Tongue.,Less Urine ,Weakness,NIL,,Mouth,Skin,Eyes,NIL,NIL,,When did you start noticing these symptoms?,Is your child drinking less than usual?,"Have you noticed any signs of dehydration, such as dry mouth, reduced tears, or sunken eyes?",Is your child unusually tired or irritable?,Has your child had any vomiting or diarrhea recently?,Has your child been eating or drinking normally?,How many wet diapers or trips to the bathroom has your child had in the past 24 hours?,Has your child had any recent illnesses or exposures to hot weather?,,,,,
C297,Dehydration in adults,All,FALSE,Excessive Thirst,Dry mouth and Tongue.,Less Urine ,Weakness,Lightheadedness,,Mouth,Skin,Eyes,NIL,NIL,,When did you start noticing these symptoms?,Have you noticed your mouth feeling dry or sticky?,Have you experienced dizziness or lightheadedness?,"Have you noticed changes in your urine, such as it being darker than usual or urinating less frequently?",Have you been drinking less water than usual?,Have you had any recent vomiting or diarrhea?,"Are you experiencing any other symptoms, such as fever or abdominal pain?",Have you been exposed to hot weather or engaged in strenuous physical activity?,,,,,
C298,parasomnia in children,All,FALSE,sleepwalking,episodes of waking up in the night panicking or screaming,Severe confusion and disorientation upon waking,Talking or eating while asleep,"Repetitive movements during sleep, such as head banging",,all,NIL,NIL,NIL,NIL,,"Does your child have difficulty breathing during sleep, or do they snore loudly?","Has your child experienced any recent stress, changes in routine, or emotional disturbances?",Are there any signs of daytime sleepiness or behavioral changes that might suggest a lack of restful sleep?,While experiencing an episode are they responsive or difficult to awaken?,Does your child have wake up really disoriented/ confused upon being woken up during these episodes,"Do you have a family history of sleep disorders, including parasomnias?",NIL,NIL,,,,,
C299,Congenital cataract,All,FALSE,Cloudiness appearance in child's eye,Child being overly sensitive to light,Child having trouble reading ,Unusual eye movements in child's eye,Child not responding to hand signals as expected ,,Eyes,NIL,NIL,NIL,NIL,,Is your child meeting their developmental milestones? I.e are they able to do everything that other kids of their age are doing ,Is there a history of cataracts or other eye conditions in the family?,Does your child track or follow objects with their eyes?,"Have you noticed any repetitive, uncontrolled eye movements?",Does your child seem to be visibly uncomfortable in bright light?,Were there any complications during pregnancy or at the time of birth?,NIL,NIL,,,,,
C300,Viral Conjunctivitis,All,FALSE,Red eyes,Itchy eyes,Watery discharge,Light sensitivity(Photophobia),Sensation of a foreign body in the eye,,White part of the eye ,NIL,NIL,NIL,NIL,,"Have you been in close contact with someone who has red, itchy eyes?", Is there a history of similar episodes in the past?,Do you have a recent upper respiratory tract infection or cold?,What is the colour and smell of the discharge?,Do you have any known allergies?,Have you used any new cosmetic or eye products recently?,Do you wear contact lenses?,NIL,,,,,
C301,Vertigo,All,FALSE, Sensation of spinning or movement,Nausea /vomiting,Balance problems,Abnormal eye movements (Nystagmus),Hearing loss or Ringing sound (Tinnitus) ,,Inner ear (Peripheral vertigo),CNS (Central vertigo),NIL,NIL,NIL,,"Does the vertigo occur suddenly and last for a short duration, or is it continuous?",Is the vertigo triggered by changes in position or movement?,Did you have fever recently?,Have you had any recent head injury?,"Do you experience any neurological symptoms (e.g., weakness, trouble speaking, altered consciousness)?",Are you currently taking any medications?, Do you have a history of migraines?,NIL,,,,,
C302,Septic Shock,All,FALSE,Rapid breathing,Rapid heart rate,Fever,Altered mental status,Feeling cold,,circulatory system,Respiratory system,Gastrointestinal system,Central nervous system,Urinary system,,Are you experiencing rapid breathing or difficulty catching your breath?,Have you noticed a sudden decrease in urine output?,"Have you had any recent infections, wounds, or illnesses?","Did you experience any nausea, vomiting, diarrhea, or signs of dehydration before these symptoms started?",Have you taken any new medications or been exposed to allergens?,Did the symptoms follow a traumatic event that lead to a lot of blood loss or spinal injury?,"Are you experiencing chest pain, palpitations, or cold/ clammy skin?",NIL,,,,,
C303,Bacterial Conjunctivitis,All,FALSE,Red eyes,"Sticky, yellow or greenish discharge",Eyelids stuck together in the morning,Gritty feeling in the eye,Blurred vision (Improves upon blinking),,White part of the eye ,Inner Eyelids,NIL,NIL,NIL,,"Have you been in close contact with someone who has red, itchy eyes?", Is there a history of similar episodes in the past?,Do you have a recent upper respiratory tract infection or cold?,What is the colour and smell of the discharge?,Do you have any known allergies?,Have you used any new cosmetic or eye products recently?,Do you wear contact lenses?,NIL,,,,,
C304,TIA,All,FALSE,"Sudden trouble walking, dizziness, loss of balance, or lack of coordination","Sudden weakness or numbness in the face, arm, or leg, especially on one side of the body",Sudden confusion or trouble speaking or understanding speech,Sudden trouble seeing in one or both eyes,Sudden severe headache with no known cause,,Brain (affected by temporary lack of blood flow),Carotid arteries (potential source of emboli leading to TIA),Heart (atrial fibrillation and other conditions can lead to TIA),NIL,NIL,,How quickly did the symptoms appear and how long did they last?,Have you experienced similar symptoms before?,"Do you have any risk factors for stroke, such as hypertension, diabetes, high cholesterol, or smoking?","Have you recently experienced any sudden changes in vision or speech, weakness or numbness in any part of your body?","Are you currently taking any medications, particularly for blood thinning or clot prevention?","Have you had any recent surgeries or procedures, especially involving the heart or blood vessels?",Any history of migraine?,NIL,,,,,
C305,Myopia,All,FALSE,Squinting or partially closing the eyelids to see clearly,Blurred vision when looking at distant objects,Headaches due to eyestrain,Feeling of eye strain when trying to view objects at a distance,,, Eyes,NIL,NIL,NIL,NIL,,How long have you noticed difficulty seeing distant objects clearly?,Do you find yourself squinting or needing to get closer to see things clearly?,Is there a family history of myopia?,"Have you experienced any visual disturbances, such as double vision, that cannot be corrected by squinting?",Do you currently use any corrective lenses,NIL,NIL,NIL,,,,,
C306,Hypermetropia ,All,FALSE,Difficulty focusing on close objects,Eye strain or discomfort during tasks like reading,Headaches after prolonged periods of close work,Needing to hold reading material farther away to see it clearly,Blurred vision when changing focus from distant to close objects,,Eyes,NIL,NIL,NIL,NIL,,Do you experience difficulty focusing on close objects or performing tasks that require seeing details up close?,Do you get headaches or feel eye strain after reading or using computer?,Is there a family history of hypermetropia or other refractive errors?,"How often do you engage in near work activities, and do you take regular breaks?",Do you currently use any corrective lenses for close work or reading?,NIL,NIL,NIL,,,,,
C307,Influenza (Flu),All,FALSE,Fever,Cough ,Sore throat ,Runny or stuffy nose,Body ache,,Respiratory system ,Whole body- pain and fever #systemic,NIL,NIL,NIL,,"Have you experienced any sudden of fever, chills, or severe fatigue",Do you have a cough or sore throat?,"Are you experiencing muscle aches, headaches, or severe weakness?",Have you had close contact with someone diagnosed with the flu or exhibiting flu-like symptoms?,"Do you belong to a high-risk group for flu complications (e.g., young children, elderly, pregnant individuals, those with chronic health conditions)?",Have you received a flu vaccine recently,Are you experiencing shortness of breath or difficulty breathing?,NIL,,,,,
C308,Acute sinusitis ,All,FALSE,Difficulty in breathing because of Nose block,Yellow or green mucus from the nose,"Pain around the eyebrows,cheeks and forehead ",Reduced sense of smell and taste,Cough ,,Nasal passage,"Behind face (frontal, maxillary, ethmoid, and sphenoid sinuses)",NIL,NIL,NIL,,"How long have you been experiencing symptoms, and did they appear during or after a cold or flu?","Do you have any allergies, and have you been exposed to any allergens recently?",Have you noticed any changes in your ability to smell or taste?,"Do you have any pain or pressure in your face, especially when bending forward?","Have you tried any over-the-counter medications, and if so, have they provided relief?",Do you have a history of sinusitis or other chronic nasal or sinus conditions?,"Are you experiencing any additional symptoms such as, dental pain, or ear pain?",NIL,,,,,
C309,Chronic sinusitis ,All,FALSE,Difficulty in breathing because of Nose block,Yellow or green mucus from the nose ,"Pain around the eyebrows,cheeks and forehead ",Reduced sense of smell and taste,Cough ,,Nasal passage,"Behind face (frontal, maxillary, ethmoid, and sphenoid sinuses)",NIL,NIL,NIL,,"How long have you been experiencing these symptoms, and have they persisted or worsened over time?","Have you had any previous episodes of sinusitis, and how were they managed?","Have you been treated with antibiotics, nasal corticosteroids, or saline irrigation, and what was the outcome?",Have you noticed any triggers or factors that seem to worsen your symptoms?,Do you experience frequent headaches or facial pain?,"Do you have a history of migraine or been diagnosed with asthma, nasal polyps, or other respiratory conditions?","Are you experiencing any additional symptoms such as, dental pain, or ear pain?",NIL,,,,,
C310,Pharyngitis ,All,FALSE,Sore throat or pain when swallowing,Red swelling behind neck sometimes with white patches ,Swelling and tenderness at the junction of head and neck,"Headache, bodyache",Fever,,Throat ,Tonsils,NIL,NIL,NIL,,How long have you been experiencing sore throat symptoms?,Do you have difficulty swallowing or does it feel painful to swallow?,"Are there any visible changes to the back of your throat, such as redness, white patches, or swelling","Do you have a cough, runny nose?",What is the colour of your sputum in the morning # if green yellow bacterial infection if greyish white indicates viral infection or allergic etiology,Do you have a history of recurrent sore throat or tonsillitis?,Are you experiencing sore throat or a swelling in neck or someplace else even after having antibiotics? #indicative of mononucleosis ,NIL,,,,,
C311,Laryngitis ,All,FALSE,Hoarseness of voice,Difficulty in speaking loudly and in severe cases difficulty in speaking normally ,Sore throat ,Dry cough ,Constant urge to clear throat ,,Voice box #larynx,Vocal cords ,NIL,NIL,NIL,,Have you been experiencing hoarseness or voice changes?,"Were these symptoms preceded by a cold, flu, or excessive voice use (e.g., shouting, singing)?",Do you have a history of smoking or alcohol use,Is there any history of throat problems or surgeries in the past?,Do you experience symptoms of acidity often?,NIL,NIL,NIL,,,,,
C313,Gestational diabetes ,All,FALSE,Unusual thirst and frequent urination,Increased hunger,"Recurrent infections, such as urinary tract infections",Increased fatigue ,Recent skin pigmentation especially if behind the neck #acanthosis nigricans due to insulin resistance ,,Urinary system,Skin,Entire body (due to systemic nature of diabetes),NIL,NIL,,Have you experienced gestational diabetes in a previous pregnancy?,Is there a family history of Type 2 diabetes?,What has been your weight gain during pregnancy?,NIL,Were any of your previous babies born with a high birth weight (over 9 pounds)?,Have you experienced any complications or abnormalities in this or previous pregnancies?,Have you observed a new skin pigmentation recently? #recent skin pigmentation indicates recent development of insulin resistance ,NIL,,,,,
C314,Diabetic neuropathy ,All,FALSE,Numbness or tingling in extremities,Pain or cramps in the legs,Muscle weakness in the hands or feet,Urinary retention or incontinence,Dizziness after standing up quickly ,,Hands and feet #Peripheral nerves,NIL,"Autonomic nervous system (impacting heart rate, digestion, sweating)",Entire body (due to systemic nature of diabetes),NIL,,Have you noticed numbness or tingling in your hands or feet?,Do you experience sharp pains or cramps in your legs?,Do you feel weakness in your hands or feet?,Do you feel dizzy when standing up quickly?,Do you have trouble sensing when your bladder is full?,Have you noticed unusual sweating patterns?,Have you experienced unexplained weight loss or digestion issues?,NIL,,,,,
C315,Diabetic Foot,All,FALSE,Visible foot ulcers or sores that do not heal,Changes in the color and temperature of the feet,Swelling in the feet or ankles,Pain or discomfort in the legs or feet,Numbness or tingling in the feet,,,"Lower extremities, particularly feet",Blood vessels ,NIL,NIL,,Have you experienced any loss of sensation or tingling in your feet?,Do you have any foot deformities or require special footwear?,Have you had any previous foot ulcers or infections?,Do your feet feel consistently colder compared to the rest of your body?,Have you observed a change in the colour of your feet especially your toes?,Have you noticed any changes in the shape of your feet or toes?,"Do you maintain proper hygiene and care for your feet, toes and specifically toe nails?",NIL,,,,,
C316,Non diabetic hypoglycemia ,All,FALSE,Feeling shaky or jittery,Sweating excessively without physical exertion,Experiencing palpitations,Feeling extremely hungry,"Confusion, blurred vision and feeling faint",,Whole body,Hand and feet ,Chest #palpation,NIL,NIL,,Do you experience these symptoms more often during fasting or after meals?,Do your symptoms get better after eating or drinking something like a fruit juice?,"Do you take any medications, including over-the-counter (like beta blockers or SSRIs) or herbal supplements?",How often do you consume alcohol?,Do you experience these symptoms usually within 12 hours of having alcohol?,"Have you had any recent surgeries, particularly involving the stomach or intestines?",Have you been diagnosed with diabetes?,NIL,,,,,
C317,Glaucoma ,All,FALSE,Gradual loss of peripheral vision,Tunnel vision in the advanced stages,Episodes of eye pain,Blurred vision ,Red eyes,,Eyes ,NIL,NIL,NIL,NIL,,Have you noticed any changes or difficulties with your peripheral vision?,Do you have a family history of glaucoma?,Do you use any corticosteroid medications?,Have you had any previous eye injuries or surgeries?,Do you suffer from other health conditions like diabetes or high blood pressure?,Have you noticed any difficulty adjusting to dark rooms or stumbling over objects on the ground,NIL,NIL,,,,,
C318,Age related cataract ,All,FALSE,Gradual decrease in vision clarity #cloudy vision ,Increased difficulty seeing in low light or at night,Sensitivity to light and glare,Need for more light when reading or other similar work,Seeing blurring around light sources #halos around lights,,Eyes,NIL,NIL,NIL,NIL,,Are you experiencing blurred or cloudy vision?,Have you noticed a gradual worsening of your symptoms over time?,Have you had to change your reading habits or require more light to read?,Have you experienced any double vision,Do you find it more difficult to see in dim lighting or at night?,"Is there a family history of cataracts, or do you have any health conditions like diabetes?",Have you been exposed to factors like smoking or prolonged sunlight without eye protection?,NIL,,,,,
C319,Secondary cataract ,All,FALSE,Seeing blurring around light sources #halos around lights,"Decreased visual acuity, not corrected by glasses",sensation of looking through a veil or curtain,Need for more light when reading or other similar work,Gradual decrease in vision clarity #cloudy vision ,,Eyes,NIL,NIL,NIL,NIL,,Are you experiencing blurred or cloudy vision?,Are you experiencing increased sensitivity to bright lights or glare?,"Do you have diabetes, uveitis, or other systemic conditions?",Have you undergone eye surgery in either eye?,Have you noticed a decline in your vision quality even after your cataract surgery?,Do you have trouble seeing things that are not directly in front of you?,Are you currently taking or have take steroid medication in past?,NIL,,,,,
C320,Traumatic cataract ,All,FALSE,Gradual decrease in vision clarity #cloudy vision ,Sensitivity to light and glare,"Decreased visual acuity, not corrected by glasses",sensation of looking through a veil or curtain,Changes in the perception of colors,,Eyes,NIL,NIL,NIL,NIL,,Are you experiencing blurred or cloudy vision?,Are you experiencing increased sensitivity to bright lights or glare?,Have you been suffered an injury to your eye recently?,Have you suffered any other eye injuries or conditions in the past?,Have you undergone eye surgery in either eye?,Did you experience immediate changes in vision following the injury/ eye surgery,NIL,NIL,,,,,
C321,Acute radiation cataract,All,FALSE,noticeably recent decrease in vision clarity #cloudy vision ,Sensitivity to light and glare,"Decreased visual acuity, not corrected by glasses",sensation of looking through a veil or curtain,Changes in the perception of colors,,Eyes,NIL,NIL,NIL,NIL,,Are you experiencing blurred or cloudy vision?,Are you experiencing increased sensitivity to bright lights or glare?,Have you noticed a worsening of your symptoms in the recent few months?,"Have you recently received any radiation treatment, particularly targeting the head, neck or chest?",Does your occupation involve work with or in close proximity to ionising radiation?,How long after the potential exposure did you start noticing changes in your vision?,NIL,NIL,,,,,
C322,Chronic radiation cataract,All,FALSE,Gradual decrease in vision clarity #cloudy vision ,Sensitivity to light and glare,"Decreased visual acuity, not corrected by glasses",sensation of looking through a veil or curtain,Changes in the perception of colors,,Eyes,NIL,NIL,NIL,NIL,,Are you experiencing blurred or cloudy vision?,Are you experiencing increased sensitivity to bright lights or glare?,Have you noticed a gradual worsening of your symptoms over time?,"Have you recently received any radiation treatment, particularly targeting the head, neck or chest?",Does your occupation involve work with or in close proximity to ionising radiation?,How long after the potential exposure did you start noticing changes in your vision?,NIL,NIL,,,,,
C323,Subcapsular cataract,All,FALSE,noticeably recent decrease in vision clarity #cloudy vision ,Sensitivity to light and glare,"Decreased visual acuity, not corrected by glasses",sensation of looking through a veil or curtain,Changes in the perception of colors,,Eyes,NIL,NIL,NIL,NIL,,Are you experiencing blurred or cloudy vision?,Are you experiencing increased sensitivity to bright lights or glare?,Have you noticed a worsening of your symptoms in the recent few months?,Are you currently taking or have take steroid medication in past?,Do you have a history of diabetes?,"Have you undergone any radiation therapy, particularly involving the head, neck or chest?",Is there a history of injury to the eye?,NIL,,,,,
C324,Pms,All,FALSE,"Emotional or mood-related symptoms (e.g., irritability, mood swings, depression)","Physical symptoms (e.g., breast tenderness, abdominal bloating, headache)","Behavioral changes (e.g., changes in appetite, sleep disturbances)","Cognitive symptoms (e.g., difficulty concentrating, forgetfulness)",Changes in libido,,all,NIL,NIL,NIL,NIL,,Are these symptoms present only before menstruation or do they persist throughout your cycle?,Have you noticed any changes in your physical health that coincide with these symptoms?,Are you currently taking any form of oral contraceptives?,Do you have a family history of PMS or other menstrual-related disorders?,Do your symptoms severely affect your daily life?,NIL,NIL,NIL,,,,,
C325,Postnatal depression ,All,FALSE,Persistent sadness or low mood almost every day,Lack of interest or pleasure in activities previously enjoyed,Fatigue or loss of energy,Feelings of worthlessness or excessive guilt,"Difficulty concentrating, making decisions, or remembering things",,all,NIL,NIL,NIL,NIL,,"Have you been feeling down, depressed, or hopeless in the weeks following childbirth?",Are you finding it difficult to bond with your baby or lacking interest in your baby?,Do you feel overwhelmed or unable to cope with daily tasks?,Did you experience any mood or anxiety issues before pregnancy?,Has there been a lack of support by your family or any other cause of stress?,NIL,NIL,NIL,,,,,
