conditionCode,conditionName,applicable_gender,pediatric_assessment,presentingComplaint1,presentingComplaint2,presentingComplaint3,presentingComplaint4,presentingComplaint5,presentingComplaint6,presentingPart1,presentingPart2,presentingPart3,presentingPart4,presentingPart5,presentingPart6,assessmentQuery1,assessmentQuery2,assessmentQuery3,assessmentQuery4,assessmentQuery5,assessmentQuery6,assessmentQuery7,assessmentQuery8,source,auxilliaryQuery1,auxilliaryQuery2,auxilliaryQuery3,prevalence_DecisionWeight
C430,Ischaemic Bowel Disease,All,FALSE,Severe Abdominal Pain ,Blood in Stools,Loose watery stools with mucus ,Nausea and Vomiting,Swelling of Abdomen,,Small Intestine,Large Intestine,Abdomen,Rectum,NIL,,When did your symptoms begin?,"Have you noticed any changes in your stools , such as diarrhea or bloody stools",Have you recently undergone any surgeries or procedures involving your abdomen?,Do you smoke or have a history of smoking?,"Have you experienced any episodes of nausea, vomiting, or abdominal swelling?","Do you have any long term disease, such as diabetes or high cholesterol?",Did you previous have such symptoms ever?,NIL,,,,,
C431,Esophageal Varices,All,FALSE,Vomiting Blood,Black stools,Abdominal Pain or  Discomfort,Weakness,Difficulty Breathing,,Esophagus,Abdomen,NIL,NIL,NIL,,When did you begin to vomit blood ?,Have you been diagnosed with liver disease?,Do you consume alcohol regularly ,Have you noticed any changes in your appetite or weight?,Do you have a family history of liver Disease?,Have you had any previous episodes of bleeding through mouth?,Have you had any recent procedures or surgeries involving your abdomen?,NIL,,,,,
C432,Whipple's Disease,All,FALSE,Long term loose watery stools,Abdominal Pain or  Discomfort,Weight Loss,Weakness,NIL,,Small Intestine,Joints,Abdomen,NIL,NIL,,"How long have you been passing loose , watery stools?","Do you have abdominal pain or discomfort, particularly after eating?",Do you feel more tired or weak than usual?,Have you had any joint pain or swelling?,Have you had any heart problems or chest pain?,Have you noticed any skin changes or rashes?,Have you had any recent travel or exposure to dirty water or soil?,NIL,,,,,
C433,Endocarditis,All,FALSE,Fever / Chills,Night sweats  or weight loss,Shortness of breath,Weakness,Joint pain,,Heart ,Chest,Heart Valves,NIL,NIL,,Since when do you have a fever?,Have you noticed any changes in your heart rhythm or heard any unusual heart sound,Have you had any recent procedures or surgeries involving your teeth?,Have you experienced any joint pain or swelling?,Have you had any recent infections or illnesses?,Have you recently be injected with any medicine?,Do you have a history of heart disease?,NIL,,,,,
C434,Angioedema,All,FALSE,"Swelling of face,lips,tongue or throat.",Swelling of the Hands or Feet,Itching or Burning sensation at the site of swelling,Difficulty Breathing or swallowing,Abdominal Pain or  Discomfort,,Face,Lips,Throat,Hands,Feet,,When did you notice the swelling ?,Have you noticed any itching or burning sensation along with the swelling?,"Have you recently been exposed to any different foods, or insect stings?",Have you ever had a similar episode of swelling in the past?,Do you have a history of allergies ?,"Have you noticed any other symptoms, such as abdominal pain or diarrhea",Have you taken any new medications recently?,NIL,,,,,
C435,Nephrotic Syndrome,All,FALSE,"Swelling around the eyes, ankles and feet.",Foamy or frothy Urine,Weakness,Weight Gain,Loss of Appetite,,KIdney,Gastrointestinal Tract,Legs,NIL,NIL,,When did you notice the swelling ?,Have you observed foamy or frothy urine when you urinate?,Have you experienced any unexplained or sudden weight gain recently?,Have you noticed any changes in your appetite or food habits?,Have you had any previous kidney problems or urinary infections?,"Do you have any known medical conditions, such as diabetes or hypertension",Have you been exposed to any medications for long period of time?,NIL ,,,,,
C436,Deviated Nasal Septum,All,FALSE,Obstruction or blockage in the nose,Difficulty breathing through nose,Bleeding through nose,Disturbance in Sleep,Runny Nose,,Nose,Upper Airway,Paranasal sinuses,NIL,NIL,,When did your symptoms begin?,Have you observed foamy or frothy urine when you urinate?,Have you noticed any recurrent runny nose with headache?,Do you experience bleeding through nose often?,Do you snore loudly or frequently wake up feeling tired?,Have you had any previous  injuries or surgeries in the nose ?,Have you noticed any changes in your sense of smell or taste?,NIL,,,,,
C437,Parkinsonism,All,FALSE,Shaking of hands/Legs at Rest,Slowing of movements,Stiffness of arms/legs,Balance problems, Depression or Anxiety ,,Central Nervous System,Musculoskeletal System,Psychiatric Manifestations,Sensory system ,NIL,,When did your symptoms begin?,"Are there any changes in your handwriting, such as it becoming smaller?",Have you noticed any problems with memory or thinking?,Have you noticed any stiffness or rigidity in your arms/legs or back?,Do you have any difficulty speaking or swallowing?,Does your partner complain of your voice being too low?,Do your friends/Family complain about your mood or facial expressions?,Have you had any falls recently?,,,,,
C438,Pneumothorax,All,FALSE,Sudden chest pain,Shortness of breath,Fast Breathing,Blue colour of lips or nails.,Sweating,,Lungs,Chest,Pleura,Respiratory System,NIL,,When did you start feeling pain in the chest?,Have you ever been hospitalized for lung-related conditions?,Have you noticed any changes in your ability to speak or move around?,Do you have a history of lung disease or previous such conditions?,Have you had any recent injury to the chest or lung surgery?,Have you ever smoked or been exposed to secondhand smoke?,Did you recently have a cough?,NIL ,,,,,
C439,Psoriasis,All,FALSE,Red Raised Patches of skin,Silver or white scales on the skin,Itching or Burning sensation in affected area,Thick nails,Joint pain,,Skin,Scalp,Elbows,Knees,Lower back,,When did you notice these patches on your skin?,Do these patches itch or burn?,"Have you noticed any changes in your nails, such as thickening or pitting?","Do you have any joint pain or unable to move ,especially in the mornings?","Have you noticed any triggers that worsen your symptoms, such as stress or certain foods?",Do you have any family members with such diseases or symptoms?,NIL ,NIL ,,,,,
C440,Gynaecomastia,All,FALSE,breast pain,swelling in the breast ,weight gain ,NIL,NIL,,sex hormones,breast tissue ,NIL,NIL,NIL,,How old you are?,when does the symptoms started?,do you have any family history of this condition?,"do you have hypertension, diabetes and any genetic disorders?","do you have any habits smoking, alcohol and allergies?",have you undergone any surgeries in the past?,NIL ,NIL ,,,,,
C441,Grave's Disease,All,FALSE,hand tremors,heat intolerance ,irregular heart rate,puffy eyes,weight loss,,Thyroid gland,heart,skeletal muscle ,eyes,skin,,when does the symptoms started?,do you have any pain in the throat area?,do you have regular or irregular menses?,"do you history of hypertension, diabetes and genetic disorders?","do you have alcohol, smoking habits and any allergies?",have you undergone any surgeries?,NIL ,NIL ,,,,,
C442,Hyperkalaemia (adults),All,FALSE,palpitations ,shortness of breath ,chest pain ,pain abdomen ,nausea,,Heart ,kidney,skeletal muscle ,eyes,skin ,,when does the symptoms started?,Do you have any chest pain and shortness of breath?,Do you have loose motions and pain abdomen?,Do you have any kidney related issues?,NIL ,NIL ,NIL ,NIL ,,,,,
C443,Premature Ovarian Failure,All,FALSE,Amenorrhea ,hot flushes,insomnia ,vaginal dryness ,infertility ,,Reproductive organs ,Endocrine organs,NIL,NIL,NIL,,when does the symptoms started?,do you have absence of menses?,Do you have any stress or decreased sleep?,Do you have any hormonal related health issues?,NIL ,NIL ,NIL ,NIL ,,,,,
C444,Oligomenorrhea,All,FALSE,Acne,headache ,vaginal discharge ,excessive hair growth ,pain abdomen ,,ovaries ,endometrium,Adrenal gland ,Thyroid gland ,Pancreas ,,when does the symptoms started?,how many days is your menstrual cycle?,do you have any weight gain or weight loss?,Do you have any hormonal related health issues?,Are you taking any medications for anything?,NIL ,NIL ,NIL ,,,,,
C445,Polymenorrhea,All,FALSE,Acne,pain abdomen ,hot flushes ,weight gain ,anxiety ,,ovaries ,endometrium ,Adrenal gland ,Thyroid gland ,pancreas ,,when does the symptoms started?,how many days is your menstrual cycle?,do you have weight gain or weight loss in recent times?,do you have hormonal issues?,are you taking any medications for anything?,NIL ,NIL ,NIL ,,,,,
C446,Psychogenic Polydipsia,All,FALSE,vomitings ,xerostomia,polydipsia ,seizures ,Delirium ,,Brain,Bladder,kidney,heart ,bones,,when does the symptoms started?,do you have any vomitings or nausea?,are you using any medications since long time?,Do you have any history of seizures?,do you any family history of genetic diseases?,NIL ,NIL ,NIL ,,,,,
C447,Intracranial Hemorrhage,All,FALSE,Headache ,vomitings ,slurred speech ,confusion ,Drowsiness ,,Brain ,Kidney,Adrenal gland,pituitary gland ,NIL,,when does the symptoms started?,Do you have any history of head injury or fall?,do you have any seizures?,are you taking any medications for anything?,do you have habits of alcohol intake and smoking?,NIL ,NIL ,NIL ,,,,,
C448,Stress incontinence,All,FALSE,during cough,during laughing,during lifting heavy weights ,during exercise ,during bending ,,Bladder ,kidney ,Brain,NIL,NIL,,when does the symptoms started?,"when does the symptoms are observed like while cough or,laugh or exercising?",have you undergone any surgeries?,how many deliveries have you undergone in the past?(in case of female),is it normal vaginal delivery or caesarean section?,are you taking any medications for anything?,NIL ,NIL ,,,,,
C449,Haemorrhoids (Internal),All,FALSE,painless bleeding ,itching around the anus,constipation ,NIL,NIL,,Anus,Abdomen,NIL,NIL,NIL,,when does the symptoms started?,do you have pain during passing stools?,do you have bleeding?,do you eat more non veg and protein food?,have you undergone any surgeries?,Are you taking any medications for anything?,NIL ,NIL ,,,,,
C450,Haemorrhoids (External),All,FALSE,itching around anus ,pain around the anus ,swelling ,bleeding ,constipation ,,Anus,Abdomen ,NIL,NIL,NIL,,when does the symptoms started?,do you have pain during passing stools?,do you have constipation?,do you eat more non veg and protein food?,have you undergone any surgeries?,are you taking any medications for anything?,NIL ,NIL ,,,,,
C451,Carpal Tunnel Syndrome,All,FALSE,weakness ,numbness,pins and needles sensation,swollen feeling in fingers,burning and tingling in fingers ,,Hand,wrist ,NIL,NIL,NIL,,when does the symptoms started?,do you have numbness and weakness?,do you had any fractures?,do you have any family history of this condition?,NIL ,NIL ,NIL ,NIL ,,,,,
C452,Superior Vena Cava syndrome,All,FALSE,cough,neck swelling ,shortness of breath ,chest pain,bluish skin,,Head ,Neck,chest,Arms,Heart,,when does the symptoms started?,do you have any headache?,do you have habits of smoking?,do you have any history of any genetic disorders?,are you taking any medications for anything?,NIL ,NIL ,NIL ,,,,,
C453,Tinea Capitis,All,FALSE,itching ,red patchy hair loss,dry scaly rashes,swollen lymph nodes,NIL,,skin ,hair,NIL,NIL,NIL,,when does the symptoms started?,do you have severe itching?,do you have any health issues?,Are you taking any medications for anything?,do you have any family history of any genetic disorders?,NIL ,NIL ,NIL ,,,,,
C454,Hashimoto's Thyroiditis:,All,FALSE,weight gain ,muscle weakness ,hair and skin changes ,tiredness,depression ,,thyroid gland ,heart,brain,skeletal muscle ,NIL,,when does the symptoms started?,what is your age?,do you have any history of autoimmune diseases?,do you have any family history of genetic disorders?,NIL ,NIL ,NIL ,NIL ,,,,,
C455,Erythema Multiforme,All,FALSE,"blisters over hand,face and soles",itching ,fever,joint pains,cold sores,,skin,mucosa,skeletal muscle ,NIL,NIL,,when does the symptoms started?,do you have severe itching?,do you have Allergies or rashes?,do you have any lung related and heart related issues?,NIL ,NIL ,NIL ,NIL ,,,,,
C456,Granuloma Annulare,All,FALSE,"red,thick firm bumps",eruption was confined to one area,NIL,NIL,NIL,,skin,fingers,hand,NIL,NIL,,when does the symptoms started?,do you have any itching?,do you expose to more sunlight daily?,have you recently taken any vaccinations?,do you had any insect or animal bites recently?,are you taking any medication since long time?,NIL ,NIL ,,,,,
C457,Vitiligo,All,FALSE,white spots or patches on skin,itching over white patches,grey or white hair,hearing loss,NIL,,skin,hair ,ears,NIL,NIL,,when does the symptoms started?,do you have any itching and pain over the area?,do you have any significant family history of any genetic disorders?,do you have any stress?,do you expose to more sunlight?,do you have any hearing loss issues?,NIL ,NIL ,,,,,
C458,Pityriasis Rosea,All,FALSE,headache ,fever,sore throat ,fatigue ,NIL,,skin,NIL,NIL,NIL,NIL,,when does the symptoms started?,do you had any viral infection recently?,do you have any history of autoimmune diseases?,do you have any family history of genetic diseases?,NIL ,NIL ,NIL ,NIL ,,,,,
C459,Keratosis Pilaris,All,FALSE,dry and rough skin,painless bumps on skin,NIL,NIL,NIL,,skin,NIL,NIL,NIL,NIL,,when does the symptoms started?,do you have any itching?,is the bumps over the skin are painful?,do you have any discharge from the bumps?,have you used any razors for hair removal?,have you done hair removal procedures like waxing?,NIL ,NIL ,,,,,
C460,Dermatitis Herpetiformis,All,FALSE,small blisters ,skin itching ,erosions,NIL,NIL,,skin,NIL,NIL,NIL,NIL,,when does the symptoms started?,do you have pain in the blisters?,do you had any viral infections recently?,do you have any lung related health issues?,are you using any medications since long time m,NIL ,NIL ,NIL ,,,,,
C461,Tinea Corporis,All,FALSE,scaly ring lesions,skin itching ,scattering of bumps above the ring,NIL,raised and expanding rings,,skin,NIL,NIL,NIL,NIL,,when does the symptoms started?,does it is present near the private areas like groin area?,do you have any discharge from the bumps?,do you have any pain?,do you have any loss of sensation over the skin?,does your family members are suffering with same symptoms?,NIL ,NIL ,,,,,
C462,Melasma,All,FALSE,hyperpigmentation of skin,NIL,NIL,NIL,NIL,,skin,NIL,NIL,NIL,NIL,,when does the symptoms started?,do you have any itching?,are you using any new creams and lotions from recent days?,do you have any family history of similar conditions?,are you taking any hormonal treatments?,are you using any medications for anything?,NIL ,NIL ,,,,,
C463,Contact Dermatitis:,All,FALSE,itching ,dry scaly skin,bumps and blisters with oozing,swelling and burning of bumps,NIL,,skin,NIL,NIL,NIL,NIL,,when does the symptoms started?,have started using any new cream or lotion?,do you have any asthma and any other health issues?,are you using any medications for anything?,NIL ,NIL ,NIL ,NIL ,,,,,
C464,Atopic Dermatitis),All,FALSE,dry cracked skin ,itching ,bumps on skin,oozing and crusting ,NIL,,skin,NIL,NIL,NIL,NIL,,when does the symptoms started?,do you have any Allergies?,do you have any lung related health conditions?,do you any family history of any health issues?,are you using any medications for anything?,NIL ,NIL ,NIL ,,,,,
C465,Lichen Planus,All,FALSE,purple lesions,flat lesions,itchy lesions,sometimes associated with painful lesions,NIL,,skin ,hair ,nails,mouth,genitals,,when does the symptoms started?,do you have itching and pain over the lesions?,do you have any liver related disorders?,are you using any medications for anything since logtime?,do you have any family related health issues?,NIL ,NIL ,NIL ,,,,,
C466,Impetigo,All,FALSE,red itchy sores,watery or pus discharge from sores,NIL,NIL,NIL,,skin,hands,NIL,NIL,NIL,,when does the symptoms started?,do you have any itching or pain?,do you had any injuries or cut over the skin recently?,do you have calcium or vitamin d deficiency?,do you have any health issues?,do you have any family history of any health conditions?,NIL ,NIL ,,,,,
C467,Traction Alopecia,All,FALSE,"receding hairline,",pimples around the receding hairline,itching and redness,patches of thin and broken hair,NIL,,hair,skin,NIL,NIL,NIL,,when does the symptoms started?,what is your age?,do you have hair loss?,do you have any family history of this condition?,are you taking any medications for anything?,do you have any stress?,NIL ,NIL ,,,,,
C468,Hepatitis A,All,FALSE,yellowing of the skin and eyes,Fatigue and general malaise,"Abdominal pain, especially in the upper right quadrant","Itching, especially in palm or soles ","Dark urine and pale stools, loss of appetite, fever, nausea",,Abdomen,Eyes,All,NIL,NIL,,"Have you experienced any changes in the color of your skin, eyes, urine, or stool?",Do you consume alcohol often? (more than 3 times in a week might suggest alcohol abuse injury on liver),"Have you had any recent exposure to blood or bodily fluids, such as through unprotected sex, sharing needles or gotten a tattoo recently?",Do you have any history of liver disease or other hepatitis infections?,How long have you been experiencing these symptoms?,Have you noticed any recent weight loss or significant fatigue?,Have you received the hepatitis A vaccine?,NIL ,,,,,
C469,Hepatitis B,All,FALSE,yellowing of the skin and eyes,Fatigue and general malaise,"Abdominal pain, especially in the upper right quadrant","Itching, especially in palm or soles ","Dark urine and pale stools, loss of appetite, fever, nausea",,Abdomen,Eyes,All,NIL,NIL,,"Have you experienced any changes in the color of your skin, eyes, urine, or stool?",Do you consume alcohol often? (more than 3 times in a week might suggest alcohol abuse injury on liver),"Have you had any recent exposure to blood or bodily fluids, such as through unprotected sex, sharing needles or gotten a tattoo recently?",Do you have any history of liver disease or other hepatitis infections?,How long have you been experiencing these symptoms?,Do you have any family history of hepatitis B or liver cancer?,Have you received the hepatitis B vaccine?,NIL ,,,,,
C470,Hepatitis C,All,FALSE,yellowing of the skin and eyes,Fatigue and general malaise,"Abdominal pain, especially in the upper right quadrant","Itching, especially in palm or soles ","Dark urine and pale stools, loss of appetite, fever, nausea",,Abdomen,Eyes,All,NIL,NIL,,"Have you experienced any changes in the color of your skin, eyes, urine, or stool?",Do you consume alcohol often? (more than 3 times in a week might suggest alcohol abuse injury on liver),"Have you had any recent exposure to blood or bodily fluids, such as through unprotected sex, sharing needles or gotten a tattoo recently?","Do you have any history of liver disease, hepatitis B or HIV infection",How long have you been experiencing these symptoms?,Do you have any family history of hepatitis C or liver cancer?,"Have you experienced symptoms such as fatigue, joint pain, or abdominal discomfort?",NIL ,,,,,
C471,Hepatitis D,All,FALSE,yellowing of the skin and eyes,Fatigue and general malaise,"Abdominal pain, especially in the upper right quadrant","Itching, especially in palm or soles ","Dark urine and pale stools, loss of appetite, fever, nausea",,Abdomen,Eyes,All,NIL,NIL,,"Have you experienced any changes in the color of your skin, eyes, urine, or stool?",Do you consume alcohol often? (more than 3 times in a week might suggest alcohol abuse injury on liver),"Have you had any recent exposure to blood or bodily fluids, such as through unprotected sex, sharing needles or gotten a tattoo recently?",Have you been previously diagnosed with hepatitis B?,How long have you been experiencing these symptoms?,Have you noticed any recent change in your symptoms or disease progression?,"Have you experienced symptoms such as fatigue, joint pain, or abdominal discomfort?",NIL ,,,,,
C472,Hepatitis E,All,FALSE,yellowing of the skin and eyes,Fatigue and general malaise,"Abdominal pain, especially in the upper right quadrant","Itching, especially in palm or soles ","Dark urine and pale stools, loss of appetite, fever, nausea",,Abdomen,Eyes,All,NIL,NIL,,"Have you experienced any changes in the color of your skin, eyes, urine, or stool?",Do you consume alcohol often? (more than 3 times in a week might suggest alcohol abuse injury on liver),"Have you had any recent exposure to blood or bodily fluids, such as through unprotected sex, sharing needles or gotten a tattoo recently?",Do you have any history of liver disease or other hepatitis infections?,How long have you been experiencing these symptoms?,Are you suffering from a diagnosed condition that has made your immunity weak like HIV/AIDS?,"Are you pregnant, and if so, in which trimester?",NIL ,,,,,
C473,Hiatus Hernia,All,FALSE,"Heartburn, worsening when bending over or lying down",Burning sensation in throat (acid reflux),Difficulty swallowing,Chest or abdominal pain,Feeling of fullness soon after eating,,Abdomen,NIL,NIL,NIL,NIL,,"Do you experience symptoms like burning sensation in the back of your throat and acidity, more intensely when lying down or after meals?",Have you noticed any difficulty or pain when swallowing?,Have you had any previous gastrointestinal surgeries or procedures?,Do you often need to take antacids or other over-the-counter medications to relieve heartburn or chest pain?,Have you experienced any unintentional weight loss or severe vomiting?,"Are there any other symptoms accompanying your digestive complaints, such as coughing, hoarseness, or sore throat?","Does your pain or discomfort improve with certain positions, such as standing up or sitting upright?",NIL ,,,,,
C474,Salmonellosis,All,FALSE,"Diarrhea, which may be bloody",Abdominal cramps ,Fever,"Possible dehydration symptoms, such as decreased urination, dry mouth, and dizziness",Nausea and vomiting,,Abdomen,head,all,NIL,NIL,,Since how long have you been experiencing these symptoms?,Have you traveled recently?,How long after eating did your symptoms start? (symptoms appear 6-72 hrs after exposure),Have you been in close contact with any pets or farm animals?,"Do you have any underlying health conditions that might affect your immune system, such as HIV/AIDS, cancer?",NIL,NIL,NIL ,,,,,
C475,Wilson's Disease,All,FALSE,"tremors, difficulty with speech, drooling, and coordination problems"," jaundice, fatigue, abdominal swelling",Psychiatric disturbances,NIL,NIL,,Brain,knee,eyes,NIL,NIL,,"Have you noticed any changes in your movement, coordination, or speech?",Have you recently been in an accident or experienced a head injury?,"Have you had any symptoms of anemia such as dizziness, tiredness, chest pain, cold hands and feet?",Do you have any history of kidney stones or renal dysfunction?,Have you been diagnosed with any psychological condition in the past?,NIL,NIL,NIL ,,,,,
C476,ACL Tear,All,FALSE," ""popping"" noise at the time of injury",Immediate and significant swelling of the knee ,"Pain, especially when bearing weight",Limited knee movement ,NIL,,Knee,NIL,NIL,NIL,NIL,,Did you hear a 'pop' at the time of injury?,How quickly did your knee swell after the injury?,Have you experienced any similar injuries to this or the opposite knee in the past?,Has the pain and swelling gone down upon bed rest and basic home care?,Have you noticed any bruising around the knee or down the leg?,NIL,NIL,NIL ,,,,,
C477,Pressure Ulcers(bedsores),All,FALSE,Skin redness or open wound in severe cases,Pain or tenderness at the site of the ulcer,Changes in skin texture or color,"In advanced stages, presence of pus, odor, or necrotic tissue ",NIL,,Back,hips,heels,elbows,NIL,,Since how long have you been experiencing these symptoms?,"Do you have any pre-existing conditions that may affect wound healing, such as diabetes",Have you been bedridden or in a wheelchair for extended periods of time?,Do you have a caretaker who takes care of changing your position when you are sleeping?,Is that carekeeper able to take proper care of your hygiene?,NIL,NIL,NIL ,,,,,
C478,Diaphragmatic Hernia,All,FALSE,difficulty breathing,Frequent respiratory infections,Abdominal discomfort or pain,Acidity ,Bowel obstruction,,Chest,Lungs,NIL,NIL,NIL,,Have you experienced any recent trauma or surgery that could affect the diaphragm?,Do you have a history of respiratory distress or gastrointestinal symptoms without a clear diagnosis?,(TO RULE OUT CONGENITAL CAUSE)- Is your infant having trouble breathing?,(TO RULE OUT CONGENITAL CAUSE)- Are you facing significant difficulty in feeding your child?,NIL,NIL,NIL,NIL ,,,,,
C479,Keratitis,All,FALSE,Eye redness and pain,Blurred vision ,Increased sensitivity to light,discharge from the eye,Feeling of a foreign body in the eye,,Eyes,NIL,NIL,NIL,NIL,,Have you recently experienced any eye injuries or trauma?,Do you wear contact lenses?,"Have you experienced similar symptoms in the past, or do you have a history of eye infections?",Are you experiencing any symptoms in both eyes or just one?,"""Is there any discharge from your eye? If so, what does it look like? (white suggests viral cause purulent suggests bacterial)",,NIL,NIL ,,,,,
